{
  "episode_id": "TIMELY_v2_12345",
  "stay_id": 12345,
  "patient": {
    "age": 65,
    "gender": "M",
    "subject_id": 10001,
    "hadm_id": 20001
  },
  "timeseries": {
    "vitals": [
      {
        "hour": 0,
        "timestamp": null,
        "heart_rate": 80,
        "sbp": 120,
        "dbp": null,
        "mbp": null,
        "resp_rate": 16,
        "temperature": 37.2,
        "spo2": 96,
        "gcs": null,
        "urineoutput": null
      },
      {
        "hour": 1,
        "timestamp": null,
        "heart_rate": 82,
        "sbp": 115,
        "dbp": null,
        "mbp": null,
        "resp_rate": 17,
        "temperature": 37.2,
        "spo2": 95,
        "gcs": null,
        "urineoutput": null
      },
      {
        "hour": 2,
        "timestamp": null,
        "heart_rate": 84,
        "sbp": 110,
        "dbp": null,
        "mbp": null,
        "resp_rate": 18,
        "temperature": 37.2,
        "spo2": 94,
        "gcs": null,
        "urineoutput": null
      },
      {
        "hour": 3,
        "timestamp": null,
        "heart_rate": 86,
        "sbp": 120,
        "dbp": null,
        "mbp": null,
        "resp_rate": 19,
        "temperature": 37.2,
        "spo2": 96,
        "gcs": null,
        "urineoutput": null
      },
      {
        "hour": 4,
        "timestamp": null,
        "heart_rate": 88,
        "sbp": 115,
        "dbp": null,
        "mbp": null,
        "resp_rate": 16,
        "temperature": 37.2,
        "spo2": 95,
        "gcs": null,
        "urineoutput": null
      },
      {
        "hour": 5,
        "timestamp": null,
        "heart_rate": 80,
        "sbp": 110,
        "dbp": null,
        "mbp": null,
        "resp_rate": 17,
        "temperature": 37.2,
        "spo2": 94,
        "gcs": null,
        "urineoutput": null
      },
      {
        "hour": 6,
        "timestamp": null,
        "heart_rate": 82,
        "sbp": 120,
        "dbp": null,
        "mbp": null,
        "resp_rate": 18,
        "temperature": 37.2,
        "spo2": 96,
        "gcs": null,
        "urineoutput": null
      },
      {
        "hour": 7,
        "timestamp": null,
        "heart_rate": 84,
        "sbp": 115,
        "dbp": null,
        "mbp": null,
        "resp_rate": 19,
        "temperature": 37.2,
        "spo2": 95,
        "gcs": null,
        "urineoutput": null
      },
      {
        "hour": 8,
        "timestamp": null,
        "heart_rate": 86,
        "sbp": 110,
        "dbp": null,
        "mbp": null,
        "resp_rate": 16,
        "temperature": 37.2,
        "spo2": 94,
        "gcs": null,
        "urineoutput": null
      },
      {
        "hour": 9,
        "timestamp": null,
        "heart_rate": 88,
        "sbp": 120,
        "dbp": null,
        "mbp": null,
        "resp_rate": 17,
        "temperature": 37.2,
        "spo2": 96,
        "gcs": null,
        "urineoutput": null
      },
      {
        "hour": 10,
        "timestamp": null,
        "heart_rate": 80,
        "sbp": 115,
        "dbp": null,
        "mbp": null,
        "resp_rate": 18,
        "temperature": 37.2,
        "spo2": 95,
        "gcs": null,
        "urineoutput": null
      },
      {
        "hour": 11,
        "timestamp": null,
        "heart_rate": 82,
        "sbp": 110,
        "dbp": null,
        "mbp": null,
        "resp_rate": 19,
        "temperature": 37.2,
        "spo2": 94,
        "gcs": null,
        "urineoutput": null
      },
      {
        "hour": 12,
        "timestamp": null,
        "heart_rate": 84,
        "sbp": 120,
        "dbp": null,
        "mbp": null,
        "resp_rate": 16,
        "temperature": 38.5,
        "spo2": 96,
        "gcs": null,
        "urineoutput": null
      },
      {
        "hour": 13,
        "timestamp": null,
        "heart_rate": 86,
        "sbp": 115,
        "dbp": null,
        "mbp": null,
        "resp_rate": 17,
        "temperature": 38.5,
        "spo2": 95,
        "gcs": null,
        "urineoutput": null
      },
      {
        "hour": 14,
        "timestamp": null,
        "heart_rate": 88,
        "sbp": 110,
        "dbp": null,
        "mbp": null,
        "resp_rate": 18,
        "temperature": 38.5,
        "spo2": 94,
        "gcs": null,
        "urineoutput": null
      },
      {
        "hour": 15,
        "timestamp": null,
        "heart_rate": 80,
        "sbp": 120,
        "dbp": null,
        "mbp": null,
        "resp_rate": 19,
        "temperature": 38.5,
        "spo2": 96,
        "gcs": null,
        "urineoutput": null
      },
      {
        "hour": 16,
        "timestamp": null,
        "heart_rate": 82,
        "sbp": 115,
        "dbp": null,
        "mbp": null,
        "resp_rate": 16,
        "temperature": 38.5,
        "spo2": 95,
        "gcs": null,
        "urineoutput": null
      },
      {
        "hour": 17,
        "timestamp": null,
        "heart_rate": 84,
        "sbp": 110,
        "dbp": null,
        "mbp": null,
        "resp_rate": 17,
        "temperature": 38.5,
        "spo2": 94,
        "gcs": null,
        "urineoutput": null
      },
      {
        "hour": 18,
        "timestamp": null,
        "heart_rate": 86,
        "sbp": 120,
        "dbp": null,
        "mbp": null,
        "resp_rate": 18,
        "temperature": 38.5,
        "spo2": 96,
        "gcs": null,
        "urineoutput": null
      },
      {
        "hour": 19,
        "timestamp": null,
        "heart_rate": 88,
        "sbp": 115,
        "dbp": null,
        "mbp": null,
        "resp_rate": 19,
        "temperature": 38.5,
        "spo2": 95,
        "gcs": null,
        "urineoutput": null
      },
      {
        "hour": 20,
        "timestamp": null,
        "heart_rate": 80,
        "sbp": 110,
        "dbp": null,
        "mbp": null,
        "resp_rate": 16,
        "temperature": 38.5,
        "spo2": 94,
        "gcs": null,
        "urineoutput": null
      },
      {
        "hour": 21,
        "timestamp": null,
        "heart_rate": 82,
        "sbp": 120,
        "dbp": null,
        "mbp": null,
        "resp_rate": 17,
        "temperature": 38.5,
        "spo2": 96,
        "gcs": null,
        "urineoutput": null
      },
      {
        "hour": 22,
        "timestamp": null,
        "heart_rate": 84,
        "sbp": 115,
        "dbp": null,
        "mbp": null,
        "resp_rate": 18,
        "temperature": 38.5,
        "spo2": 95,
        "gcs": null,
        "urineoutput": null
      },
      {
        "hour": 23,
        "timestamp": null,
        "heart_rate": 86,
        "sbp": 110,
        "dbp": null,
        "mbp": null,
        "resp_rate": 19,
        "temperature": 38.5,
        "spo2": 94,
        "gcs": null,
        "urineoutput": null
      }
    ],
    "labs": [
      {
        "hour": 0,
        "timestamp": null,
        "creatinine": 1.2,
        "bun": null,
        "sodium": null,
        "potassium": null,
        "bicarbonate": null,
        "chloride": null,
        "ph": null,
        "lactate": 1.5,
        "wbc": 12.5,
        "hemoglobin": null,
        "hematocrit": null,
        "platelet": null,
        "glucose": null,
        "albumin": null
      },
      {
        "hour": 6,
        "timestamp": null,
        "creatinine": 1.5,
        "bun": null,
        "sodium": null,
        "potassium": null,
        "bicarbonate": null,
        "chloride": null,
        "ph": null,
        "lactate": 2.1,
        "wbc": 12.5,
        "hemoglobin": null,
        "hematocrit": null,
        "platelet": null,
        "glucose": null,
        "albumin": null
      },
      {
        "hour": 12,
        "timestamp": null,
        "creatinine": 1.8,
        "bun": null,
        "sodium": null,
        "potassium": null,
        "bicarbonate": null,
        "chloride": null,
        "ph": null,
        "lactate": 2.7,
        "wbc": 12.5,
        "hemoglobin": null,
        "hematocrit": null,
        "platelet": null,
        "glucose": null,
        "albumin": null
      },
      {
        "hour": 18,
        "timestamp": null,
        "creatinine": 2.1,
        "bun": null,
        "sodium": null,
        "potassium": null,
        "bicarbonate": null,
        "chloride": null,
        "ph": null,
        "lactate": 3.3,
        "wbc": 12.5,
        "hemoglobin": null,
        "hematocrit": null,
        "platelet": null,
        "glucose": null,
        "albumin": null
      }
    ],
    "start_hour": 0,
    "end_hour": 24,
    "resolution_hours": 1,
    "n_timepoints": 24,
    "missing_rate": {}
  },
  "clinical_text": {
    "notes": [
      {
        "note_id": "note_001",
        "note_type": "Radiology",
        "note_category": "Chest X-ray",
        "chart_hour": 4,
        "chart_time": null,
        "text_full": "CXR shows bilateral infiltrates consistent with pneumonia. No pleural effusion.",
        "text_relevant": "bilateral infiltrates consistent with pneumonia",
        "text_length": 0,
        "has_llm_features": false
      }
    ],
    "llm_features": [],
    "n_notes": 1,
    "note_types": [],
    "coverage_hours": []
  },
  "reasoning": {
    "condition_graph": {
      "nodes": [
        {
          "condition": "Sepsis",
          "icd_codes": [],
          "is_present": true,
          "onset_hour": 12,
          "confidence": 0.0,
          "source": ""
        },
        {
          "condition": "Pneumonia",
          "icd_codes": [],
          "is_present": true,
          "onset_hour": 4,
          "confidence": 0.0,
          "source": ""
        }
      ],
      "edges": [
        {
          "source": "Pneumonia",
          "target": "Sepsis",
          "relationship": "causes",
          "temporal_order": "before",
          "time_delta_hours": 8,
          "evidence_type": "",
          "evidence_pmid": null
        }
      ],
      "primary_condition": "Sepsis",
      "complexity_score": 0.0
    },
    "physiology_templates": [],
    "detected_patterns": [